reviewId,app_name,content,sp_ordinal,sentiment_binary
1e6b5be2-31c0-46ff-adf7-ce3e79ecdad7,Tiktok Lite,acho recompensas deveriam melhores pois faz propaganda enganosa dizendo coisa fazendo outra acho interessante alguns vídeos classificação melhor pagamento melhoro classificação,0,10
8026d359-47b3-409e-98c3-f5e91ef7ea6d,Tiktok Lite,dei estrela porque zero aplicativo tá m rda dá vê fotos precisa melhora muita coisa tou falando coisas aplicativo si precisa melhora tudo obrigado atenção espero tenhas atualizações melhoras agradeço equipe,1,1000000
ef7f9905-d4e8-4b74-ae5e-ae87c44bb63d,Tiktok Lite,bom leve normal problema tipo aparece vídeo aí parte negocinho chegar rápido vídeo queremos segunda coisa ruim figurinhas fez vídeo pesquisar quer resto tudo bom então tik tok lite,0,10
1b58b201-51a9-4453-b05e-ee72d3220956,Tiktok Lite,parou funcionar agora ocorre erro falso informando celular conectado internet instável vale pena passar tanta raiva bugs paciência estresse,1,100000
6fd2ac13-6218-42a8-8671-dd8e9a4291a1,Tiktok Lite,gosto app único problema ter opção tik tok normal ativar ferramenta desenvolvedor ajudar analizar curtidas visualizações vídeos horário prometo opção vou dar estrelas além disso app bom,0,10
80757b35-14bd-4ee4-b940-24b7ff05265e,Tiktok Lite,app bom muitas coisas rolagem automática alguns filtros etc n trava diferente tik tok normal,0,10
e189b6dd-5e4c-4392-b7af-aecb65fe7fb9,Tiktok Lite,então consigo postar capcut consigo ver algumas postagens fiz outro consigo ver curtiu consigo mexer postagens quero fazer colocar lento rápido mexer foto enfim horrível vou ficar aqui porq outro tá bugadao sugestão tragam tudo outro pra cá,1,100000
c65ae5b9-ff16-41e7-9b76-a316e3da5391,Tiktok Lite,aplicativo trava variedades filtros tanto gostei vou dar segunda chance voceis melhorarem aplicativo quero ver vídeo trava pede reiniciar aplicativo gostei aplicativo thau,1,1000000
5c3aeeee-d6b8-463d-afbf-010d4ae21388,Tiktok Lite,lite bom ainda falta possibilidade visualizar publicações fotos pois ainda preciso usar app normal poder acessar app normal ocupa espaço absurdo demais experiência idêntica,0,10
37b92fcd-52cb-4551-9095-d7af777d5332,Tiktok Lite,aplicativo bom celulares tanta memória disponível coisa sinto falta nesse aplicativo ter republicado ter função igual tik tok normal exemplo efeitos etc espero próximas atualizações coloquem coisas pois acho aplicativo faltando aplicativo bom consegue tirar tédio facilmente aplicativo perfeito vou dar quatro estrelas causa coisas falei,0,10
a67e207d-f72c-4459-8cef-1354d885c18d,Tiktok Lite,tik tok lite aplicativo conteúdo variado diverte inteligente serve bastante divertir passar tempo colirio olhos satatisfazer mente sinto satisfeito aconselho pra gosta divertir,0,1000
67eab8f6-3780-4f02-8f20-2722813f0ff0,Tiktok Lite,tik tok lite bom ver vídeos comendo criadores vídeos realistas bons cinco estrela porque paro ver passa dia todo tik tok lite bom conseguir entrar galeria escolheria ver todos vídeos visto recomendo use aplicativo,0,1000
41bc8a72-e2c4-4bf4-baad-a24248799cbb,Tiktok Lite,app bom acho deveria ter função republicar ver republicados opção eviar amigos caixa mensagens tbm enfim tirando app ótimo,0,10
bed4b949-75da-45c0-a387-c590f814a759,Tiktok Lite,único problema algumas coisas emojis tiktok aqui algumas funções posta conteúdos recomendo nada assiste compartilha vídeos recomendo bom,0,10
e6b847de-7a59-4c23-91ff-6ccc36422f0e,Tiktok Lite,gosto app poderia liberar opção divulgar contato antes atingir seguidores assim programar postagem versão web tema escuro,0,10
e227e343-ecee-4703-931e-5370b7277be6,Tiktok Lite,queria ver páginas app sim bom buga mensagens nn chegam cedo consigo ver páginas probleminha legendas ficam cortadas nn tradução texto quero atualize logo,1,100000
11f5dbc7-d0c9-42d5-ab3a-bf97a33ca2fe,Tiktok Lite,super legal coisas etc si app trava bug promete usado internet mentira testei super horrível cada coisas nesse app acho dever mudar coisas pq quero ficar usando aplicativo bug celular então tik tok life melhorar viu pq paga pra ficar usando aplicativo bug espero pq melhorar venho faço reclamação tik tok pq vc fica igual verdadeiro bem melhor lgl,1,1000000
681acb90-9242-4ae7-b69e-196447ba8584,Tiktok Lite,bom porém opção fixar letras palavras mto pouco pesquisar stickers mto defeitos mto bom,0,10
4a671a62-ca96-4d10-9e76-427fd9c60ea5,Tiktok Lite,aplicativo perfeito funcionamento última atualização encheu bugs demora pra carregar próximo vídeo além algoritmo colocando coisas gente pesquisa gosta,1,100000
69a9bd67-5c35-489a-9a92-35603b5e22f2,Tiktok Lite,bom trava tals mass poderiam colocar opção republicar vídeos assim normal conseguir ver vídeos fotos tirando bom,0,10
007476df-8454-44e2-919c-32614eb791f9,Tiktok Lite,experiência sido boa sinto entregam conteúdo melhor forma outras usuários existe hora apropriada divulgar vídeo sei gosto experiência,0,10
2d293567-9782-4e5f-b4b7-f51e3020c980,Tiktok Lite,estrela porque última atualização app começou travar nada relatei suporte nada simplesmente além responder apagaram tudo relatado antes problema app fiz tudo limpei cache nada agora começou vir vídeos repetidos fy vídeos curti além disso app nenhuma novidade dizem novas ferramentas nada novo ainda nessa última atualização apagaram efeitos favoritei,1,100000
8edfe984-46a8-484c-a215-5d11cf8d0533,Tiktok Lite,coisas poderia melhorar tiktok lite colocar hashtags igual tiktok normal poder ver descrição completa vídeos pq mostra parte dá pra ler inteira outro podia ter opção ver comentários comentei vídeos igual tiktok normal,0,10
6b45c811-7268-4046-aada-cb3dfa5215c4,Tiktok Lite,aplicativo ótimo têm problemas claro todos outros apps adicionem logo oportunidade assistir vídeos fotos,0,10
88f60636-fdcf-4ab3-9ea5-e9fb635acdd5,Tiktok Lite,app ótimo leve tudo contudo repetição reels ocorrem bastante diferente versão tik tok normal,0,10
75ef529e-92dd-42f3-9b3c-d17f944f8405,Tiktok Lite,aap ótimo celular muita memória problema vídeo travar vezes preciso postar duas vezes conseguir resultado,0,10
154b0731-67e7-432e-b034-3c0b00925c87,Tiktok Lite,app boa único problema consigo fazer vídeos colocar resposta pedido seguidores ecrã vídeo normalmente responderes comentário vídeo lado comentário aparece câmera aparecer câmera,0,10
25e2e83b-3013-449d-9c5e-269faace11a2,Tiktok Lite,adorei app leve trava gostaria próxima versão atualizada permitir postar fotos porque ainda acesso permitido queria falar favor atualizem usar fotos,0,10
2be3a972-3bf7-488e-bb09-c952e79744bd,Tiktok Lite,aproveimento positivo relativamente aplicação todas precauções necessárias afinal tudo vantagens disvantagens embora detectados ainda outro lado aplicativo experiência bastante positiva aplicativo satisfas necessidades procura nele,0,1000
138f44ea-41f0-4209-820d-7ca0752db2e0,Tiktok Lite,aplicativo ótimo bom bom ter anos aceita menos anos porque protocolo escolhe filho pode pode falar pessoa sempre bom voltar filho assistindo tik tok anos fã quis criar conta porque tô medo hackeada aplicativo todo mundo gente gostei número aumente acho melhor instalo fez coisa repreendido melhor jogo dessa população,1,10000
ff245204-aeca-4fb8-8713-a29fdad65149,Tiktok Lite,bom app leve rápido tiktok normal dando nojo mecher tantos travamento bugs baixei lote testar travamentos sumiram,0,1000
60f22ce2-98fa-44be-b90b-bfce4c2e7a30,Tiktok Lite,aplicativo bom porém valoriza começando foryou existem vídeo menos k viws então começando oportunidade pois vídeos entregue público máximo pessoa vê ai vídeos esquecido pode vídeo maior qualidade assim entregue infelizmente pra apenas assistir bom legal,0,10
c6c67892-a37b-4fdf-be2a-be4b27cef44a,Tiktok Lite,achei app maravilhosa tudo nao perfeito celular nao aparece filtros novos filtros la dai quero testar filtro nao acho podia ter opiçao usar efeito pessoas tao usando tik tok normal,0,10
7a5d0a38-3c52-4238-a6a2-d021a53af1d2,Tiktok Lite,tik tok lite legal vários tipos efeito tudo oq queira lite opção responder comentário vídeo pq alguns aparelho celular trava tik tok normal pfv coloca opção lite ai vai fica ainda melhor q criador conteúdo influêncer preciso responder alguns comentários vídeo pq celular trava tik tok normal pfv coloquem opção responder vídeo pfv queria lite,0,10
8f732521-bbaf-4d17-8632-70063f614905,Tiktok Lite,mediano falta ainda muita coisa pra melhorar tipo visualização fotos localização vídeos feed,0,10
35aed91e-8c67-46d5-aee3-90e198b3e394,Tiktok Lite,opinião melhor aplicativo tik tok amo perfeito coisas reclamar pq baniram conta ja fezes nao posto nada anos ai colar outra idade pois nao asseita idade chato tirando ta ótimo,0,10
3e7d60d4-0a31-42bf-ae0d-c5f2dc7bcb45,Tiktok Lite,talvez melhor retirada aplicativos celular vovó vovô joana paulino casal filhos netos todos pegam celular favor façam melhor agradeço celular fizer ligação responder pra mim tá ótimo desde agradeço muitíssimo,0,10
b9aea3db-ad9f-425a-aeeb-3e38f5fc782d,Tiktok Lite,aplicativo bom dou estrelas ótima plataforma simplesmente notei debilidade conectar internet apresentado falha colagem,0,10
861726df-55a6-4bc8-8c18-aa29e6bcd20d,Tiktok Lite,app si bom efeito meio preferido efeito una noche queria colocassem tiktok lite pois efeito uso vídeos tiktok normal pesado celular j podem fazer fazer favor,0,10
67361aa4-7e09-4f7a-9be5-aff7399b23ba,Tiktok Lite,gostei tik tok lite dessistalo toda família gosta espero q comentário ajude dúvidas sobre app mim super aprovado poderia mudar apenas aparecer apenas pessoas famosas pessoas poucos seguidores poderia mudar ter coloca nome verdadeiro login gosto disso quase conta motivo,0,10
31fcc0da-65a7-4228-bcb6-6621229c64c1,Tiktok Lite,tô gostando ainda fase avaliação acho app pedem avaliação logo seguida vc instala app agem má fé pressionando usuário pra livrar insistência logo estrelas tentativa livrar logo incomodo então acho avaliações sobre pressão valor pois retratam verdadeiro parecer avaliador,1,100000
7f8c988d-8a43-461a-98e1-b0bb86327b1d,Tiktok Lite,acho bem prático usado vídeo sao maravilhoso montagem vídeos opção conteúdos perfeito so entendo pq nao consigo ter visualizações curtidas comentários,0,1000
a07983fd-04d0-48c2-9706-31bcf9207284,Tiktok Lite,gosto desse aplicativo atualização consigo compartilhar vídeos porque outros precisam ter aplicativo ver toda vez achava vídeo engraçado mandava amigos agora dá,0,10
f3e9d5f3-e272-4f3b-b671-f44401e75345,Tiktok Lite,vai ter opção deixar mudo muita coisa legal ouvir música usando tik tok ótimo,0,10
d629f28f-aee0-4f2f-8ca4-5672b96b826e,Tiktok Lite,odiei brilho fica aumentando automaticamente retirar funcionalidade,1,1000000
273ad565-7d03-4986-a141-36b172f659d9,Tiktok Lite,app bom fazer logo atualização poder ver fotos tento ver foto consigo acho ruim consegui ver então faz atualização conseguir ver fotos,0,10
56cf07c3-83aa-45c6-a6aa-04fc2af62a90,Tiktok Lite,péssimo aba melhores simplesmente sumiu ninguém responde feedback vezes fica tao lento q n pra entrar,1,1000000
2bebedc9-f5b3-4e2e-8ffd-f8eeb1addb38,Tiktok Lite,app bom podia ter função repúblicar ver fotos pq vezes chato vc entra vídeo foto aí dá pra ver vc quer repúblicar vídeo dá,0,10
2bbaf01b-4295-4976-97d0-f3309f78e342,Tiktok Lite,bom toda via precisa melhorar qualidade gráficos pode melhorar efeitos etc acho bom app melhorar bj pra leu aq opinião ok,0,10
8b885444-5a64-4f75-97f2-6f4ef68910f2,Tiktok Lite,excelente aplicativo conhecimento diversão recomendo dúvida vale pena criar perfil tok tok parabéns criadores faz tempo passar depressa,0,1000
2efd7c67-d658-4752-a407-216d938364bf,Tiktok Lite,bom aplicativo gosto pois distrai bastante chegar trabalho tantos problemas realmente relaxante valeu pessoal,0,1000
badcbcf6-5f63-4077-8544-3099c221b758,Tiktok Lite,app bom legal velocidade tirando bom legal leve nokia tijolão custa mb mb leve bem tiktok normal chega pés lite tiktok normal custa mb muita memória nokia tijolão tá memória app vale apena baixar,0,1000
44b2a501-753d-493c-b256-6bd1083a5ff5,Tiktok Lite,n goxtei asmei incrível amei nova textura azul play story voltando tik tok bom adoro vídeos posso curtir comentar postar vídeos,0,1000
2cdd33b8-fee4-4efb-8993-e3f577851f7a,Tiktok Lite,app excelente travamentos funciona versões antigas android android tudo porém tiktok lite desatualizado diferente sucessor tiktok normal muitas funções aumentar velocidade ver video imagens enquanto tiktok lite nao entao favor querem concorrer público econômico precisam manter tiktok lite atualizado acordo normal tirando tudo bom,0,10
370287f2-a5a0-4f2a-902a-98fa2bae1c0d,Tiktok Lite,gosto versão lite tik tok pós roda normalmente celular contrário versão original meses uso consigo ver poste fotos acesso vídeos uns meses prometem ter função ver postes foto agora nada,0,10
24ad521f-4074-4932-9435-41c5bf84da40,Tiktok Lite,mudei radicalmente opinião tik tok lite exemplo aplicativo lite deveria mantém várias funcionalidades padrão removendo realmente pode pesar lembrando versão pra assiste vídeos pra pensa fazer pena ainda possuir modo escuro acho padrão deve ter ainda pra android funcionalidade básica pra qualquer app levar anos pra adicionar complicado viu,0,10
8dc9e1ea-4f23-43af-acd0-9482ebc5e331,Tiktok Lite,aplicativo altamente otimizado proporcionando experiência excepcional navegação suave tempos carregamento rápidos consumo recursos mínimo eficiência notável garantindo desempenho excepcional longa duração bateria escolha ideal busca app rápido eficiente alto desempenho,0,1000
2ccd705f-1d76-4ce3-bd67-e60614cd79c6,Tiktok Lite,acho q dei nota causa efeitos q série ainda precisa melhorar forma tratar contas pequenas criando vídeos cai muitas vezes finalização vídeos demora d fica parecendo q querem q faça dezenas problemas vizualização q acho n critério posto vídeos várias plataformas aqui visualização vídeo baixa dia neimar jr visualizou video q gerou quase visualização migalhas,0,10
080b5044-bb0b-4c6d-9b7d-a57bcbaf6b21,Tiktok Lite,app boa fácil usada algumas anomalias notei exemplo tiktok lite consigo fazer login outras contas youtube instagram etc pouco número efeitos aqui sequer opções tela verde aparece opção colocar tiktok modo claro escuro ephá muitas coisas notei descrever vou terminar agora gostaria app opção texto falado,0,10
c34f5538-18c4-4017-9a13-cf09b85e72ac,Tiktok Lite,bom parabéns desenvolvedores entregaram oque prometeram trava nada tela lisa parece tiktok travado usava porém nada perfeito hoje darei estrelas pois gravo vídeos utilizo app pois tiktok normal trava falta milhares efeitos favor adicionem faltando muita coisa super útil pra grava vídeos ótimo,0,10
cd7de589-5486-4ab9-9540-d3e218d0f4f2,Tiktok Lite,bom bem leve bem otimizado único problema alguns recursos outra versão versão lite claro menos recursos atrapalha experiência ver vídeos coloquei estrelas,0,10
9df3c9c2-2482-44f3-b925-1f767c0a39d1,Tiktok Lite,app ótimo sério poderiam disponibilizar função ver vídeos fotos arrasta favor,0,10
971f3318-081b-462a-87ec-f48bde69b837,Tiktok Lite,gosto plataforma banido maneira vou outra conta vem aviso banido permanente conta nova consigo resolver bem opção ajuda,1,100000
bfc23336-c792-4829-a1b3-4f42654dff82,Tiktok Lite,app si ótimo melhor tradicional porém cadê opção post vídeo foto tá hora atualizar viu assim venho aqui estrelas,0,10
761981ab-f64f-4fbb-86be-0a6e51c9894e,Tiktok Lite,app principal travando desinstalei vim titok lite melhorou precisa ícone legendas,0,10
3cd27ac3-0111-4876-a07a-4fe49d81a991,Tiktok Lite,tintos du acho bom porque ensina muitas coisas boas outras deixa desejar porque muitas coisas ensina metade poriço vou dar estrelas,0,10
0f0c8609-d084-46b3-b051-62b3622826e9,Tiktok Lite,entendo reclama versão aplicativo função x função y coisa tal etc sentido lite justamente ter coisas fazem aplicativo pesado memória principalmente pra quer uns vídeos aleatórios pouco deixar pra lá cumpre função perfeitamente,0,1000
f59ef841-0ea4-49a7-8cf5-8eb0ec9b8529,Tiktok Lite,adoro ir nessa loja meninas sempre atende bem ajuda acho algo sempre atenciosa educada produtos bem encontra,0,1000
20de173f-52ac-4757-b923-39746e9f13ac,Tiktok Lite,bom app si ótimo afinal cadê post fotos quase anos atualização ñ vem então espero arrumem logo cheguei ter tiktok normal percebi melhor espero arrumem logo porfavor,0,10
c48620b7-973b-496a-8b48-39bff4691fd2,Tiktok Lite,olha chateada aplicativo tik tok confundiram mensagens excluiu todas mensagens desse violei diretrizes nunca aida mandou dizendo engano pediu desculpa constrangedor gostei bastante direta falo porque alertando participante golpe disse porque aplicativo tik tok gente usando foto americanos fazer golpe mulheres sim testemunha gratidão sempre,1,100000
cc18a9f2-a2d6-4e68-880b-6613369f4c60,Tiktok Lite,gosto deste app nsei posto foto consigo escolher música pra ouvir pra escolher podem ajudar resolver obrigado antecipadamente,0,10
59bf9e0b-9b60-422f-b04a-659812337dd8,Tiktok Lite,app si mt bom coisas mt ruim n poder ter acesso muitos efeitos botar muitos sons voz app ótimo,0,10
f37b75bc-28ce-4127-974b-a4292501b717,Tiktok Lite,bom vezes apresenta alguns defeito desde atualizei dá zoom aguento baixar efeitos,0,10
b96d00db-1d53-48d6-bca0-8cc0a11b311a,Tiktok Lite,app mt bom recomendo mt além disso gasta pouquinha memória pro básico causa efeitos todos tirando app mt bom super recomendo,0,10
0be50ffe-4254-46f4-ba5d-2416884d94ba,Tiktok Lite,simplesmente perfeito comecei usar conta tik tok bugado percebi bom lite menos pesado bom usar celular pouca memória antigo bom experiência sido perfeita parabéns favor baixem,0,1000
72fa196f-68e4-4be3-9e92-c4161da7013d,Tiktok Lite,bom viciante muitas pessoas perdem controle ações causa vício aplicativo causa causa procrastinação entao caso vc herdeira tarefas trabalho fazer nao recomendo,0,10
3ef0a091-9c4f-42ba-95c3-3ac46f6492a7,Tiktok Lite,app ótimo diretrizes duras baniram conta causa video carros altas velocidades sendo vejo coisas tema sexualidade,0,10
bb2494a3-7100-46b7-828f-59d9f10ecf40,Tiktok Lite,mt bom ótimo pra mt espaço cell função ver foto fala função vai lançar breve agr nada estrelas função,0,10
d87c246b-191f-474c-a5ac-ea8006aea030,Tiktok Lite,gostei porque mesma coisa tik tok normal tirando bom efeitos pra ter nao live nao velocidade vi video odeio entra escrito coisas nota,1,1000000
ea950824-a107-4c21-b243-a2231db82c75,Tiktok Lite,bom tik tok algumas coisas pessoal acho quê postar anos recomendo pessoas maiores anos,0,10
8f7b5050-c1cf-4e97-a7cb-b8dea20d8a42,Tiktok Lite,bom conhecer pessoas comunicar ganhar dinheiro lá pra certos tipos talentos pra mim funcionou,0,10
f977bb05-70d5-428e-91e0-d0ee6329c8ce,Tiktok Lite,olá app top uso porém consigo fazer download vídeos compartilho enviando assim hoje link,0,10
382de96f-a76b-41dc-8f98-ad4a4f47eef0,Tiktok Lite,falta algumas opções versão original questão app melhor versão normal trava,0,10
6b9bda10-c70c-4a52-9783-f9f30c53f736,Tiktok Lite,porque app aparece lives vai barra pesquisa aparece nada vídeos perfis tiktok faça favor corrigir,1,100000
231dd0f4-cbd4-41fa-9fbf-94ced353a471,Tiktok Lite,bom cumpre promete poderiam atualizar acordo app original ficaria melhor ainda obrigada oferecer app excelente,0,10
35949c3c-2ab8-44b1-ba5d-6726dd400a91,Tiktok Lite,adoro amo dms gosto parte vídeos flopam ok né bem oq queria perguntar vcs vão colocar opção ver fotos criar outra conta ver lives bem poderia ter ocupando menos dados ideia gostarem dessa ideia respondam pfvr ficarei feliz dms,0,10
54121039-d9c4-4386-bca5-8b0708587433,Tiktok Lite,aplicativo bom tendo alguns bugs entregando conteúdo certo entregando coisas interesse integrando coisas totalmente aleatória,0,10
b1254fb1-972f-41a3-9eef-2ffdc5fb7412,Tiktok Lite,vezes aparece agente segue tá seguindo teque renicia celular ruim agora tá bloblema quer postar nada,1,1000000
e34134cf-7d2c-4189-806e-3b32fe31479c,Tiktok Lite,bom apricativo ajuda pouco pessoas espalha vídeos gente ver ruim devia deixar vídeos livre todo mundo ver ganhava seguidores curtidas kawai ajuda pessoal,0,10
7b9743ca-1b6e-47e2-85fb-9373a7273dee,Tiktok Lite,app bom reclamações app ótimo pra passatempo pra distrair dou estrelas ótimo,0,1000
1cdfbf87-63fd-4e96-926f-f2c6661e5551,Tiktok Lite,nao gostei atualizao video nao vao antes enviando zap antes pessoa via video ter q entrar tik tok agora q ter tik tok pra ver video posto video tik tok status agora parei conta disso pessoa ve status q entrar tik tok pra ver q postei sensura pois pra mim tao ruim posto coisa edifica vida melhor palavras boa criador algo q vai faser sentir bem muitas pessoas q so ver,1,100000
806858a4-f36d-4ece-a3f2-6569ab9d6ebf,Tiktok Lite,bom achei bom causa dá fazer vários vídeos dá fazer várias coisas aplicativo música achei bom porque lá vários famosos famosa,0,1000
1b3202e6-f7d9-45d6-8b3e-3673c6c63852,Tiktok Lite,bom acho poderiam adicionar função modo escuro app função vídeos fotos,0,10
5a1f874c-1d8f-4d37-beea-44c1885e25db,Tiktok Lite,dizer plataforma utilizada mundo inteiro gostei pk pesa nenhum bocado super sofisticado aplicativo ter opções dá pra responder mensagem vídeos dá pra colocar modo escuro pra sincronizar tik tok lite cupcut aplicativo ter várias alterações tik tok ter opções além disso efeitos estremamentes podre tentei baixar,0,10
7b69b038-0728-44be-ac36-086820119622,Tiktok Lite,perfeito agora falar tiktok amando sempre faço vídeos lá precisa ir capcut falar tiktok agora falar vídeo nenhuma edição pra tá ótimo parabéns trava perfeito única edição falar,0,1000
742c0314-1e22-4784-b4ce-1ac8d66cfac4,Tiktok Lite,bom dia tik tok app muitas adversidades apresenta sempre momentos contagiante muitas energias boas,0,1000
8ccd3997-0710-4186-9eda-6c0789d78adb,Tiktok Lite,exceção pra alguns vídeos tik tok ajuda muitas pessoas através muitos vídeos bom pra mim presta coloco bolso furado,0,10
4097350b-32af-4980-a625-4a82504bc454,Tiktok Lite,ainda continuo consegui atualizar foto perfil atualizei google foto aplicativo ainda continua anterior resolvam aí,1,100000
7ec26a80-e2f4-4221-9e57-18a6154e8794,Tiktok Lite,gosto app quero comentar q app toma espaço memória quase gb espaço toda vez atualiza fica cada vez maior pouco espaço aparelho,0,10
f9268486-15bf-49e7-b309-e1b311f1256e,Tiktok Lite,bom super econômico rápido falar trava top,0,1000
4e1c0ca8-e746-4862-bde9-d31eadd119aa,Tiktok Lite,poderia ter opção bandeirinha adicionar favoritos igual tik tok normal responder pessoa marcar mesma setinhas deixar tela inteira novamente aí ficaria bom,0,10
965a9ba2-2fa7-4c7f-8cb5-738f85c8981d,Tiktok Lite,tiktok normal sempre travava cerular tiktok life bom rapido pequeno prático pacote per feito pra gente cerular fraco recomendo,0,1000
c5573426-b00d-453d-99b7-79d4fdb2880d,Tiktok Lite,tiktok bom filtros efeito abrem fazer vídeos sei celular tento fazer vídeos dançando abre,0,10
1a3b94b5-66bd-4f33-85dc-f7e652def89e,Tiktok Lite,app bom pois difícil q faço conteúdo tik tok permite imagens ocasionando instalo outro app edição vc quer gravar pro tik tok aí sim bom instalar aproveita segue lufinho,0,10
24cb409a-82a8-4706-8d16-e9e735483c70,Tiktok Lite,amo tik tok lite appe incrível nota dou estrelas aproveito postam nesse aplicativo vezes exemplo vida pra mim obrigada todos faz i uso desce aplicativo parabéns,0,1000
72940a44-5e61-476d-9860-a095fa09ccfd,Tiktok Lite,primeiramente boa noite sei conta mi pedem vídeo dá responder comentário vídeo sei desatualizado quê consigo msm novamente atualizei problema mantém,1,100000
7d8c6186-3944-460f-ba69-c2a216ba8a1a,Tiktok Lite,informo melhor antecipado jornais livre expor ideias grande admirador china tudo fazem inteligente disciplinado,0,1000
65631714-2059-4d29-882b-952341739079,Tiktok Lite,lite funciona melhor cadê lives dai usar outro bug demais probleminhas melhor,0,10
1a875967-0dc0-4855-99fa-f5fefd5bd72e,Tiktok Lite,uso tiktok quase anos disso apareceu conta suspensa idade sendo comecei usar quase anos anos agora esperar vejam consiga conta volta pode consiga gostava vídeos coisas aparecem lite aparecem normal espero resolvam logo,1,100000
49bd694e-e644-49ab-b08e-a563d4025ad1,Tiktok Lite,app ñ muitos filtros menos querer responder comentário vídeo aparece muitas configurações acho deveria ter mesma qualidades tik tok kit,0,10
3fe34db3-6e96-45f2-b57a-8d4f7d3f88be,Tiktok Lite,app si bom tudo perfeito então começo condo instalei consigui criar conta tirando app ótimo super recomendo beijos,0,1000
51019480-0fcc-4426-945a-a855727dcbb3,Tiktok Lite,app si bom função foto cadê tbm todos efeitos tiktok normal então pra falar tchau,0,10
f96faa51-05c3-4582-8623-f4df289fb716,Tiktok Lite,app simples perfeito únicas coisas q encomoda fato poder publicar vídeos minuto poder postar fotos app mt bom,0,10
65c81642-b64f-4659-91f7-6d15aebbd031,Tiktok Lite,complicado pode responder videos sair chat privado fotos pode ver melhorem ne favor,1,100000
7ccc5af5-6b8a-4d8b-86cd-14bb0b64272c,Tiktok Lite,ótimo mundo app nao estudo vcs carinho honestidade profisisonalismo trazer formula ajudar participar tudo nessecitamos obrigado,0,1000
96c25893-9444-4fbf-a2e8-4acb58dce7ff,Tiktok Lite,app bom umas coisas poderia colocar tipo mandar ft manda mensangem poder duas pessoa seguir i tiktok lite mudar dou estrelas pesso umas pessoas ajudar,0,10
917fd81f-fb20-4ae1-b28f-5f993cd868ec,Tiktok Lite,bom vezes assistindo vidio trava demora normalisa vidios poderiam ter tempo reprodução tipo músicas,0,10
09ce3fde-5fad-4b30-8c9c-044ce5b87648,Tiktok Lite,vou dar estrelas pq app ótimo precisa melhorar trazendo novas atualizações tipo rebublicar vídeos fotos tiktok normal,0,10
