reviewId,app_name,content,sp_ordinal,sentiment_binary
4b063478-4072-4774-9e56-b3366994c3e0,Instagram,ta tendo bug qualquer áudio menos gravado direct instagram play áudio toca áudio gravado outro lugar tipo app gravar voz áudio whatsapp documento áudio alguém mandar pra mim direct ai funciona,1,100000
e4056a73-9660-42b2-86d8-4e1e18fbef1e,Instagram,mano insta tá bugando câmera trava filtros aparece áudio indisponível outro problema irrita galera agr coloca música nota muitos conseguindo música pq aparece opção pôr música tbm consigo,1,100000
b9fe60ae-a250-4d7b-9e69-b9a4070947e2,Instagram,aplicativo começo bom começou ter algumas falhas tipo conseguir escolher própria música disponíveis ali si umas músicas ridículas melhorem vão perder usuários,1,1000000
833df588-a619-4caa-a8ea-c4fbcbc77c04,Instagram,última atualização deixa meio perdidos sei acontece comigo posto alguns stories apago atualizo ainda lá ultimamente disponível áudio postagens conhecidos fica aparecendo indisponível todo tempo,1,100000
ab31bf16-5a93-43e6-9f0c-8d12a16a1ed5,Instagram,última atualização carrega direct conta consigo enviar receber mensagens além perder todas anteriores sei faço pois sempre alguém manda mensagem consigo ver barra notificações deixar ver direit carrega infinito pra dizer existe conversa frustrante,1,1000000
c56e39f8-d759-4bcc-9476-a0a5f568d0a0,Instagram,aplicativo tá funcionando bem nada consigo postar feed músicas português porque simplesmente pesquiso aparece aparece pequena quantia músicas inglês affffffff,1,1000000
4e60a936-6a51-4fe3-8e8a-f5d4a39a78a7,Instagram,tudo bem nada storys guardados destaques arquivados carregam ficam totalmente pretos seta meio tentar voltar carregar nao funciona tentei arquivar voltar fechar app tudo funciona comuniquei problema ainda fizeram nada contrario piorou deste então antes story preocupei agora importantes mim resolvam favor,1,1000000
c0fba0d1-4e9c-40ad-9c2f-c1c15f7c65fa,Instagram,estressado aplicativo músicas destaques funcionando alem carregamento posts fotos lento bugs acontecem constantemente aplicativo horrível deveria melhorar criarem melhor,1,1000000
8233f185-a908-40e7-a5fa-0e08bfe4a64a,Instagram,completamente bugado tentar fazer post múltiplas fotos reel quase missão impossível fotos galerias ficam repetidas dá pra escolher recente bug dois dias nada carrega,1,100000
2b10e4fb-b408-4892-8a97-e4fed04382af,Instagram,app apresentando muitas falhas músicas disponíveis stories áudio vídeo corta horrível usado péssimo,1,1000000
0e5eccb1-2480-412b-920e-aeb86e5ab9ba,Instagram,conta instagram aparece opção coloca música perfil atulizei monte vez nada resolve amava usa instagram agora demora pra atualização completamente atualiza recursos ficando ruins espero consiga atualização coloca música perfil tambem vou fazer alguma postagem ai coloco musica foto minutos vou ver aperece musica indisponivel ja ficando chato,1,100000
aab5a150-f54d-4101-8e8f-33bb9d667d6f,Instagram,app incrível últimas atualizações dm quase abre tocamos ícone grupo adicionar alguém mudar nome alterar ícone demora séculos abrir vezes abre,1,100000
d4f36f3f-2648-4376-a857-18d057f35912,Instagram,gosto muitos reels melhor app comunicação entretenimento vi algumas coisas q podiam mudar certo limite contas verificadas tipo tanto certo seguidores pra alcançar verificação porque vejo muitas pessoas quase nd seguidores verificado lado exemplo seguidores pessoa qualquer verificação n faz sentido nenhum alem injusto ridícula ridícularizar n símbolo,1,100000
07e42061-9556-4332-a416-5303f2dd8d9d,Instagram,gosto aplicativo porém ultimamente apresentando problemas hora incluir musica storys músicas conhecidas antes apareciam coloco pesquisar musica aparece diz,0,10
0d08118c-af48-467f-8e85-24471e9a7814,Instagram,estrela vai continuar sei diacho músicas brasileira aparecem pra mim digito mostra nenhuma coloco outro célular aparece aplicativo atualizado então porque continua bug,1,1000000
48bc510c-9aba-43e4-8aee-352b019b91e6,Instagram,algum motivo consigo colocar nenhuma música notas opção simplesmente aparece mim apenas diz música escolheu pode disponível música menos opção selecioná la,1,100000
9cdc2b42-b530-4b03-b704-e67433bc4133,Instagram,app tava tudo normal tempo pra cá ruim agora consigo ter acesso música pra mim gosto posta fotos vídeos colar músicas agora acesso música estranhas aplicativo libera favor concertem logo bug,1,100000
edeac4f7-93c3-4940-8596-be6f765ba1c7,Instagram,atualização piorou tudo plataforma demora demais pra entregar atualizações sempre chega apenas alguns opção música notas poucos têm enfrentam problema conseguirem utilizar dessa ferramenta,1,100000
3cf13c5f-c7a6-42ba-a1ea-bc21b9e673c5,Instagram,app bom porém péssimo pra recuperação contas opção observação falsa fala foto perfil podem usar pra fazer identificação facial aperto opção sim levam pro código verificação via sms acesso nisso perdi conta hoje funcionasse deveria recuperado acesso conta tempos atraso atualizações app bom melhorar,0,10
0d696f1c-5eff-4d48-85db-9aeef5823707,Instagram,app bom porém uns tempos pra cá horrível celular aparece músicas notas postagens feed pesquiso alguma música story aparece inglês,0,10
af373aa2-68be-447d-b535-9dcb68872437,Instagram,instagram áudio indisponível todas fotos feed outras pessoas consigo selecionar audios preferência colocar publicações gostaria saber pode resolvido faz uns dias,1,100000
3908f092-0fa5-46a3-88a1-6c652ea349a3,Instagram,instagram bom pra ficar pior hoje postar story aí ficou bug pode botar música português fica dizendo música indisponível favor tire bug gosto tanto usar tento todo jeito youtube jeito segui passo passo deu certo favor tire bug vcs demais fazer favor tire bug imploro obrigado ter lido tudo favor ajude,1,100000
6878bd89-b962-40e1-90da-800764836070,Instagram,app bom porém última atualização deixou pouco chateada envio reels alguém envia pra mim hora abrir buga aparece outro reels gosto desse app ultimamente tá bugando espero consertem rápido possível,0,10
ba9c9888-5937-434d-b79d-d61b373c59d5,Instagram,aplicativo bom coisa incomoda aplicativo vai fazer check up segurança conta instagram obriga mudar senha indicaria colocar opção precise mudar senha outra coisa instagram deixa encerrar check up segurança porque fica dizendo requisitos cumpridos sendo cumpri todos requisitos mostra lista requisitos proteger conta,0,10
b350723b-fb0d-4dcb-92a5-36f65d2e59d0,Instagram,instagram aplicativo bom engraçado fotos tiradas próprio app aparecem cortadas vai postar faz sentido nenhum bem poderiam configurar acontecer saco ter ficar editando fotos outro app muitas vezes deixo postar acredito muitas pessoas,0,10
84ea42f6-0db8-4c21-86e2-e08f14eff3b3,Instagram,app bugando tento fazer publicação consigo colocar música preferencia receio ocorrer mesma coisa storys amei terem colocados musica notas bio favor arrumem bugs,1,100000
66bbc696-0492-4716-8727-977d5502736b,Instagram,aplicativo buga certa frequência durante trocas páginas opção música notas saiu contas atualizações estando dia tirando probleminhas app bacana,0,10
c3e37edd-0eba-46cf-8f35-08d91a4abe53,Instagram,app cada vez horrível tira foto salva aparece galeria agora deu mostrar visualizações story aff bem podiam melhorar corrigir falhas desse jeito compensa ficar whatsapp olha lá ainda,1,1000000
81612483-30a1-4e70-af9c-b6b594729827,Instagram,app bom porém algun erro aconteceu exemplo músicas vou escolher música pra storys aparece quero escrevi errado nome sim próprio instagram melhore pfvr obrigado colocar músicas chatas story bye,0,10
b800b8ef-0607-4272-842d-7862f78a611e,Instagram,aplicativo incrível porém venho tendo muitos problemas feed carrega direct demora pra carregar vídeos sai áudios internet pois outros celulares redes mesma coisa gostaria equipe melhores aspectos infelizmente desistalar aplicativo,0,10
6e420be3-4045-4a6c-a536-8e11b5b98348,Instagram,gosto app realmente app bom porém vezes demora carregar vez vídeos simplesmente trava começo passando somente pedaço vídeo fechando abrindo app novamente parece demora bem antes tirando app bom,0,10
bc50e8dd-1bf5-43f8-a6b1-3f1bb2152bed,Instagram,bom app tendo uns problemas tipo bugando exemplo chega notificação curtida vejo curtida vou pra pesquisar alguém fica notificação pessoa visto tirando app bom ótimo maravilhoso gosto dia dia entrar app ficar conversando próximos,0,10
52f4bcd1-237e-4082-b4de-e548d2b5de22,Instagram,conta hackeada consigo apoio suporte instagram mandei email obtive resposta tentei fazer reconhecimento facial enviar vídeo carrega final erro carregar vídeo tente novamente tarde enfim sei fazer,1,10000
291b0b8f-ac8b-4099-869e-b8a29c3890b6,Instagram,tô conseguindo colocar música stories quero postar vou procurar nome artista aparece exemplo dias postar foto queria colocar músicas colocar nome artista luiza sonza dá nenhum resultado encontrado,1,100000
e100d752-fb92-4a71-825e-9af1b499df02,Instagram,faz dias direct funciona tá bugado consigo ver mensagens aparecem notificações vou responder clicando nela aparece mensagem dizendo autorizada responder acontecendo perfil comercial fiz tudo volta normal socorro,1,1000000
9e567b67-026a-485c-9437-f03f04303eb0,Instagram,modo escuro cheio bugs acessar reels voltar feed fonte palavras publicações fica modo claro impossibilitado leitura somem ícones curtir etc,1,100000
5c121151-2c1e-4530-a070-c660228eca5d,Instagram,aplicação parece versão alfa feita amadores alguns problemas basicos barra vídeos ocupa toda largura tela impedindo mover extremos dedos possível pausar nenhum vídeo nenhum tipo vídeos sendo tocados impedem tela modo espera preciso destravar finalizar vídeo impedem página atualizar antes finalizar links diretos carregam menos instagram reiniciado limpar cache,1,1000000
d1326b7d-9cb6-4feb-bbaa-eec9555a1779,Instagram,gosto instagram ultimamente tendo muitos problemas stories sempre posto algo fica dando parte tela verde foto destorcida tentar postar mesma coisa vezes pra conseguir postar bugs horrível estresse coisa simples gente perde tempo vezes acabo desistindo usar ferramenta trabalho preciso ficar tentando postar favor corrijam,0,10
1516f883-c18e-4c3c-8865-969e90e48a74,Photo&File Detect,aplicativo abriu vez disso ganho lista contatos pude ver realmente aplicativo instalei desinstalei app nada funcionou fico aplicativo funciona além disso celular bugado fica aparecendo vários anúncios meio nada agora escrevendo apareceu anúncio adeus espero app denúnciado,1,100000
8d2864dc-54b1-4800-a149-948c3399e962,Photo&File Detect,app horroroso fica aparecendo anuncio nada outra agora comentário escrevi apareceu anúncio funciona abre lista contatos outra quero denunciem aplicativo tirem google play outra querem instalar recomendo,1,1000000
ba77313e-d0ed-476a-93df-0bc697e633ef,Photo&File Detect,vei app lixo entrei nenhum site contém anúncios troço aparece minutos tô achando propaganda vírus pq abaixei tantas vezes anúncio aparecia melhorou nada recomendo,1,1000000
137f7a0d-9867-4bd6-9e35-9af1a30cd02e,Photo&File Detect,app lixo fica vindo anúncio minutos consigo fazer tarefa online quizziz atrapalha agora desinstalei vê anúncio fala limpa vírus deixa vírus ainda recomendo,1,1000000
2acee340-8613-4ae3-a174-8ac1f8e32ca2,Photo&File Detect,horrível sobrepôs outros app fica domínio celular muitas muitas propragranda consegue usar app pois fictício pede permissão precisa extrema complexidade denunciem app,1,1000000
af7c58e2-e3bd-48a7-b123-77183eb4b486,Photo&File Detect,resolver propagandas passo baixe es file profile aqui playstore passo vá aplicativos veja aplicativos aparecem vírus deisistale geralmente pronto nada,2,100
6f3b3b2d-04c4-44f7-8222-606b6bfdcee2,Photo&File Detect,horrível app lix fica aparecendo direito anúncios estando outro aplicativo muda imagem pra contados hora vc entra aplicativo aprece todos contatos,1,1000000
b093d5dd-8fae-41fe-bcef-3752692fe92a,Photo&File Detect,ruim cada minutos anúncio chato pode app fazer instalado instalar pra tirar anúncio,1,100000
41ea659d-7c54-4267-91ed-233570825bad,Photo&File Detect,daria nota propagandas chatas aparecendo tempo todo bem melhor intalavr avg anti virus tomara propaganda chata sai ar,1,1000000
6283b751-ea98-490f-887d-9340922a1218,Photo&File Detect,acabei instalar achei chato tava jogando gacha nox aí aparece celular virus aí aparece desistir limpo aperto dois aparece mesma coisa pra abaixar aplicativo chato mano,1,1000000
e7b00e62-2d86-4659-802a-71be7e820e64,Photo&File Detect,totalmente inapropriado propaganda ficar aparecendo celular segundos odiei vou dar jeito parar,1,1000000
07cecb76-6b97-40e0-818b-de5ed39b9a63,Photo&File Detect,péssimo app bem anúncio cada segundos consigo escrever aplicativo funciona baixou desistale anúncios ficam perseguindo internet bem propaganda,1,100000
3957096d-b359-4589-a302-acd4988c9138,Photo&File Detect,anúncio segundo ninguém merece irrita atrapalha vez ajudar desculpa,1,1000000
4189e1a8-14cf-454d-9124-9e50d8b99a56,Photo&File Detect,ruim consigo fazer nada celular pq app anúncio trava celular abaixe,1,100000
4db23f9b-d4d1-4eef-84f6-1179938a92d7,Photo&File Detect,app lix tava mechendo celular aparece dunada aplicativo aparece min chato instala fica pior ruim recomendo jeito nenhum,1,1000000
ac077f23-207b-479a-ab91-ba887a12094d,Photo&File Detect,instalei app engano fica escondido aplicativo contatos fica mostrando banners propagando horrível devia banido google play store,1,1000000
886c0d99-37ca-4a92-9362-a01a7c58bbf0,Photo&File Detect,denunciem app denunciem várias vezes fica invadindo celular toda hora aparecendo notificação prejudica funcionamento,1,1000000
316e3490-a528-4d10-b271-e61cf1dbc090,Photo&File Detect,des baixei app celular parou travar aparecia anúncios aplicativo internet recomendo,1,100000
656f9f09-4b70-43f7-8ed5-8041e6f1ddbe,Photo&File Detect,puro adware baixem serve passar anúncios donos app ganharem dinheiro cima celular app função,1,1000000
1a5d07ca-f32f-4bb3-97f5-7f33f4b98f5f,Photo&File Detect,trava enche aparelho anúncio estrelas pq enquanto fuçava app apareceram diversos anúncios vírus forçar parada desse,1,100000
d209ab6a-6d61-4ea8-af41-0b33e92d404c,Photo&File Detect,app pessimo minutos fica aparecendo anuncio msm instalando app nn funciona pessimo nn recomendo,1,1000000
dcd8dbc2-0667-4398-9190-78ac4d987c35,Photo&File Detect,app lixo dois dois min aparece anúncio n consigo entra zap,1,1000000
92a761ee-596f-4cb4-be48-ac86b080d68a,Photo&File Detect,terrível pior app q vi vida abaixei pra vê ficar aparecendo anúncios terrível,1,1000000
c28a5768-24cb-4a9b-ac04-b77775ee6869,Photo&File Detect,eusem querer baixei vírus celular ficava aparecendo anúncio cada minutos n sei usar hacker vc vendo comentário ensina mexer nesse aplicativo,1,100000
694f9d7a-d51e-46eb-907b-1d4a5c76a99a,Photo&File Detect,péssimo aplicativo aparece propaganda cada min muita raiva,1,1000000
6941cd57-24c8-4254-9db1-bd88ebd3e6aa,Photo&File Detect,aplicativo horrível instalei ficou aparecendo monte comercial segundo segundo vou fazer agora n chega anúncio,1,1000000
06ea56b1-850d-4b62-9c16-24b41bb64c18,Photo&File Detect,orrive consigo entrar app toda hora entro jogo online anúncio app faz aparecer tira jogo,1,1000000
e29ed392-f32a-4cf4-be4c-7d9d7be1cb2d,Photo&File Detect,gostei desse app toda hora aparece propaganda dá usar celular,1,100000
763a7910-0d29-4a69-bd44-dded1e7ab626,Photo&File Detect,epp horrível aparecer consigo escrever play store fica parecendo anúncio enstalen,1,1000000
1306ab18-e93a-47ee-b5b1-14975bcab436,Photo&File Detect,horrível app abriu deu vírus recomendo nenhum pouco,1,1000000
9f9a310f-6899-43a0-88d8-5dbd1f021426,Photo&File Detect,entrando lista contatos abre app acho dando algum problema,2,100
8e845b51-c191-426c-8714-7fc97f289baa,Photo&File Detect,virus programa fica mostrando publicidade todo tempo tela celular,1,100000
b37a7a11-caf2-49b9-af8a-bd52a4236716,Photo&File Detect,app horrível n tira anúncios n sei pessoas colocaram nota boa pra app lix n merece baixado baixei pra xigar app lix bos nunca baixem app vai colocar anúncios tirar espaço super n recomendo,1,1000000
9a2ec15e-ad4f-4ae7-b59a-14743e353339,Photo&File Detect,estrelas motivo toda vez aparece anúncio aplicativo semphoto filedetect,1,100000
91162445-6c48-45ad-b7c0-749db4f0914d,Photo&File Detect,ruim instala pessoa têm acesso chato,1,1000000
cc5f8071-abce-4b7a-bf4a-e8df1c0dffd9,Photo&File Detect,baixem aplicativo vírus pai querer instalou celular ficou vírus celular começou travar dava anúncio atrás anuncios dava pra mexer nada vês baixar aparece ícone aplicativo contato duplicado vcs querem celular vcs instalem queria pedir ajuda todos avaliarem mal app outras pessoas caem obg todos,1,100000
76b0a153-8fb1-4c3b-8048-08e4e837c108,Photo&File Detect,tirar anúncios pq du nada aparecem chato ñ tirarem vou denunciar pq ñ quero aplicativos cll fica mnts mostrando sendo q ñ quero vou denunciar ñ tirarem,1,1000000
5ae2e3eb-51d8-4a69-9819-79d2c0bf04c8,Photo&File Detect,aplicativo péssimo contém muitos anúncios sempre faz trava cllr,1,1000000
09e9764b-e340-47ef-b8a4-e567a1346942,Photo&File Detect,tempo todo aparece propaganda desse app piscando tela,1,100000
b48466a6-174d-431e-87c7-83500c38823c,Photo&File Detect,aplicativo ruim vcs ficam toda horas mostrando pr aplicado celular coloco aplicativo quero vcs acham ter,1,1000000
301b1904-99e2-4a38-9cd3-f70a1d222150,Photo&File Detect,cara segundos fica aparecendo anúncio disso baixei ver saia ainda aparece,1,100000
6da7953f-64ab-44f9-91f5-fd9b5de2ca66,Photo&File Detect,app ruim tô vírus aparece anúncio chato nao recomendo app lixo,1,1000000
5e08718a-d152-41ff-aad0-d9a632c417ce,Photo&File Detect,ruim fica parecendo segundo vírus certeza,1,100000
8d229b77-a5a7-4d9f-a66d-e35c393957a5,Photo&File Detect,celular espludiu causa desse app lixoooooo odiei celular bugou todos denúciem app nao conseui entrar nesse lixo fica aparecendo anúcio toda hora tento entrar,1,1000000
11302038-e175-4bb5-bba6-4b822a938d71,Photo&File Detect,referido aplicativo contém anúncios sobrepõem quaisquer outros aplicativos cada minuto nada surge anúncio aparelho fica literalmente controle pessoas leigas conseguem entender motivo anúncios acabam preocupando chegando perder precioso tempo indo assistências técnicas desenvolvedor aplicativo quer lucrar exibindo anúncios qualquer custo,1,100000
ad063b84-417b-4e73-a606-3acd184a39f9,Photo&File Detect,vejo aplicativo ante vírus perturbando,1,1000000
a88213e7-64c0-44df-8bea-90026bc2d510,Photo&File Detect,ruim vem anuncio cada segundos,1,100000
0f0689c8-655e-4ca7-a047-7592d2d58c7f,Photo&File Detect,horrível fica colocando propaganda toda hora app,1,1000000
5e17ace3-88a0-46e8-a0f6-ba2300ae9fb5,Photo&File Detect,fica toda hora perturbando aplicativo tô cansado favor perturba fica toda hora mandando anúncio,1,100000
aacc66ac-18b9-4f2d-8b93-f8c8066a9480,Photo&File Detect,app merd viu abre fica toda hora tela aparecendo anúncio desse app,1,1000000
6df62619-0954-4544-b145-a5720bb5dc0e,Photo&File Detect,filho baixou querer app l x desinstalei assim pipocar anuncio deixado vírus celular cada toque tela cell aparece anuncio barulho alarme horrível palhaçada baixem,1,1000000
2e24d63d-c95d-481d-826c-da1cb7fa3814,Photo&File Detect,vírus fica aparecendo propaganda tela celular minuto irmã instalou tava cell deu trabalho sáber onde tava vindo anúncios kkk ainda aparece tela inicial celular pra impedir vc achar desinstalar instalem coisa fica aviso,1,100000
17ca958d-a439-4046-a97f-281052608360,Photo&File Detect,horrível trava toda hora abre direito péssimo horrível falar anciões né insuportável,1,1000000
936c36bb-110e-4b18-82b6-a43d0efcc782,Photo&File Detect,maravilhoso ótimo trabalho realizado rápido,0,1000
950bbb25-1ae3-4a3c-b4ae-6590028d89af,Photo&File Detect,todo tempo interrompe navegação,1,100000
d05b064c-571a-439f-b04d-a99947f4716e,Photo&File Detect,mano aplicativo serve pra fica invernizando falando to virus aplicativo horrivel abaixa favor,1,1000000
e268f355-1a36-41ce-acfb-14f2d1703e5a,Photo&File Detect,aplicativo funciona direito,1,100000
5e8802bb-a962-4c8a-b8de-f6fc1d6cd359,Photo&File Detect,app ruim pq testei sempre tá anúncio instagram cão,1,1000000
5b1eb7c5-c0b0-445c-bb3e-7969c12f4409,Photo&File Detect,aplicativo horrível demais toda hora fica mostrando anúncio,1,1000000
4da8360c-9ea8-4288-92b5-9c74b912f577,Photo&File Detect,app ridículo abaixado aplicativo aparece toda hora saco cheio,1,1000000
201212b7-9f50-4dbc-a841-2156b25e6b15,Photo&File Detect,lixo aplicativo toda hora buzina vírus desinstalei sai celular,1,1000000
021ca79f-c814-43e3-8e92-15839cc66e3f,Photo&File Detect,véi app horrível minutos aparece anúncio n recomendo,1,1000000
11bd1421-a431-4ee4-a208-bceff317ef5b,Photo&File Detect,aplicativo abre propagandas celular tampo todo,1,100000
d60b393f-38fa-4f29-96fc-db67dc2f1724,Photo&File Detect,aplicativo aparece outra imagem fica difícil acha aplicativo pra vc tá removerndo,1,100000
7c4fb9c8-1964-4e7f-8ec4-25d0fb11aef2,Photo&File Detect,acabei abrir vou ver bom cel travando apenas estrela pra valiar darei cinco bom,2,100
f8b44210-4d12-4650-8a6d-e314b9e53a4a,Photo&File Detect,coisa chata mechendo celular apagando fotos aparece anúncio cada segundo chato deus,1,1000000
8e6dffa0-8b9c-4fae-81ad-1942c6c5ef86,Photo&File Detect,app vírus fica tofo momento apresentando anúncios permitindo fazer nada telefone outros apps,1,1000000
27bf153c-7221-4e6e-8659-b7538d493ac1,Photo&File Detect,péssimo gostei desse aplicativo toda hora aparece celular poder abaixar indico ninguém abaixar,1,1000000
a37bb41d-e160-460d-915e-3f3ab0940697,Photo&File Detect,muita propaganda tempo todo,1,100000
d8a226df-3391-457a-b92e-c6b79170a5d9,Photo&File Detect,horrível app dar pra fazer nd simplesmente anúncio,1,1000000
a8798f4e-520a-4ad2-9c62-45004af7678f,Photo&File Detect,insatisfeito app porque nao limpa nada mi fais raiva éu quero verdade verdade interesse pode mandar mensagem pra baixar porque suu positivo aceito verdade desculpem falei coisa errado bom dia,1,1000000
6694d7c8-20af-4443-8528-84e998ed4cc0,Photo&File Detect,ñ gostei anúncio ñ abre nada,1,100000
319b4bf2-caa1-4cc0-b524-ab57cd287bac,Photo&File Detect,vi bom mim cancelei vi vários comentários bons vi ruim cancelei,2,100
a4089bc5-2d88-474f-8c6c-cd378c1bcb83,Photo&File Detect,baixei ver parava aparecer anúncio,1,100000
01a21255-4ab8-4a9e-a047-db8e800e4470,Photo&File Detect,horrível serve pra entupir celular anúncio,1,1000000
3bc2a6a0-bd0d-4b43-b107-9f677923557f,Photo&File Detect,muita mensagem enche saco pode apagar,1,1000000
5ac3f507-3c47-4a06-8910-7971548ac3ae,Photo&File Detect,horrível baixei n consegui entra dis bom verdade horrível maís,1,1000000
b49b4a0f-96da-4a37-a396-7f5d177a3aed,Photo&File Detect,garoto ta certo aplicativo lixoooooo fico jogando aparece recomendooooo quero play store tire app daqui app ridiculo feio,1,1000000
ad5ec5a4-6615-4f7d-8f1a-423eabef1ce5,Photo&File Detect,vms lá app horrível atrapalha plmdsparade aparecer app trouxe vírus celular,1,1000000
e595eb5d-3d40-412c-bc5f-07fa30eb2a1f,Photo&File Detect,horrível fica passando anúncios,1,1000000
a8a5ab36-9140-4b7b-9fa7-b20e2bf1ec4f,Photo&File Detect,gosto desse aplicativo fazendo coisas telefone toda hora trava,1,100000
88fcad73-558a-4488-bc2f-cdd1da39aa22,Photo&File Detect,chato anúncio,1,100000
03c7f273-674a-4cd1-9a99-5667d6381471,Photo&File Detect,aplicativo lixo serve nada fica vindo comercial instalando desse dar zero estrelas dava app lixo serve pra porr nenhuma,1,1000000
ac396386-c016-4c4d-bfc3-c4f3262360f3,Photo&File Detect,aparece videos atrapalha,1,100000
ead1732f-3fd7-4bc2-bc01-6b37e93d7d17,Photo&File Detect,consigo tirar anúncios,1,100000
236eeb3a-396b-4bbb-9ff5-70708fa8b79a,Photo&File Detect,mó chato inclusive propagandas ficou parecendo toda hora chato,1,100000
ef8f37a9-cf29-420e-8fdb-c45b47dd5efa,Photo&File Detect,app aparecer nn cell quero ver algo vídeo nn dar causa desse app,1,100000
c1026e57-cc94-4fba-ba01-645b28d3d897,Photo&File Detect,mano vai engana trouxa velho coloca vírus celulares outros cada segundos aparece anúncio celular,1,1000000
c79713b5-733c-415f-9737-7c178bb32de2,Photo&File Detect,consigo fazer limpeza celular aplicativo,1,100000
fce2890a-ff23-4732-b82c-21459d784b36,Photo&File Detect,chato toda hora fica aparecendo,1,100000
7110a4cd-5067-4198-99fb-e231139c6b15,Photo&File Detect,quero app fica entrando celular atrapalhando outros apps quero,1,1000000
55f63cb7-e066-4c27-ad6a-6b8e13f97e1b,Photo&File Detect,gostei coloquei pra foto vai pra contatos,1,100000
b3998335-eb5c-4454-bd63-aa2aa7fb35a7,Photo&File Detect,quer abrir sei celular ruim ouu aplicativo,1,100000
8116087d-7d17-4b23-b3d6-8adc73af9a1c,Photo&File Detect,ruim coleta dados,1,100000
bc805fd6-6f40-4464-b9cb-f2133c832ed8,Photo&File Detect,ruim nao pra clicar ja aparece anucio,1,100000
ae7a8d12-329d-41f8-9c58-1c3c7da8c5aa,Photo&File Detect,gostei desse aplicativo ruim causa gastar bateria,1,100000
7e0f3f1e-27b3-4e94-b87d-be8394dd8821,Photo&File Detect,aparece anúncio toda hora desse aplicativo,1,100000
674c842c-eeda-4041-a7f5-00eefc4c00c4,Photo&File Detect,péssimo aparecer anuncio,1,1000000
c0477337-073f-416c-af36-61a8acf636d4,Photo&File Detect,baixei aplicativo fazer limpeza recomendada deu nada,2,100
88cea4c4-d743-464e-821d-2f30ced4f4bf,Photo&File Detect,péssimo fica toda hora entrando anúncios,1,1000000
da2a5fe7-6299-4284-ba85-c41d9456d631,Photo&File Detect,nada dizer horrível baixei pra propaganda aparecer,1,1000000
f77de6e2-c08a-4c35-8740-5892e3489f4a,Photo&File Detect,desgraça ruim n presta pra nada dá raiva desgraça dessa vendo desgraça desse app nao usse desgraça desse app,1,1000000
